Trait,Question
Extraversion,I enjoy socializing and being around other people
Agreeableness,I tend to see the best in others and give them the benefit of the doubt
Conscientiousness,I like to plan my activities and stick to a schedule
Neuroticism,I often worry about things even if there is no immediate reason to
Openness,I love exploring new ideas and trying new experiences
Extraversion,I feel energized and motivated when interacting with others
Conscientiousness,I tend to be organized and prefer to have things in order
Neuroticism,I am generally calm and composed even In stressful situations
Openness,I appreciate and enjoy various forms of creative expressions
Agreeableness,I am sensitive to the needs and feelings of others